{
  "$schema": "http://json-schema.org/draft-07/schema#",
  "title": "ASDD Run State",
  "description": "Estado del workflow ASDD en curso. El orquestador actualiza este archivo tras cada checkpoint (ORC-007). Persiste ante /compact, /clear, errores de API y cierres de sesion.",
  "type": "object",
  "required": [
    "run_id",
    "feature",
    "started_at",
    "last_checkpoint",
    "status",
    "phases",
    "context_summary",
    "resume_hint"
  ],
  "properties": {
    "run_id": {
      "type": "string",
      "description": "ID unico del run. Formato: YYYY-MM-DD-NNN",
      "example": "2026-04-28-001"
    },
    "feature": {
      "type": "string",
      "description": "Descripcion breve del feature o tarea en curso"
    },
    "started_at": {
      "type": "string",
      "format": "date-time"
    },
    "last_checkpoint": {
      "type": "string",
      "format": "date-time",
      "description": "Timestamp del ultimo checkpoint escrito por el orquestador"
    },
    "status": {
      "type": "string",
      "enum": [
        "in_progress",
        "complete",
        "blocked"
      ]
    },
    "current_phase": {
      "type": "string",
      "enum": [
        "specify",
        "analyze",
        "design",
        "build",
        "verify",
        "document"
      ],
      "description": "Fase ASDD activa del run. Token en ingles, alineado con las claves de 'phases' (nunca en espanol, ej. 'disenar'/'verificar'). Lo escribe el orquestador en cada checkpoint (ORC-007). Si esta ausente o no matchea el enum, el helper de naming y el guard de artefactos hacen fallback a phases.*.status === 'in_progress' (Bug A item A2)."
    },
    "phases": {
      "type": "object",
      "properties": {
        "specify": {
          "$ref": "#/definitions/phase"
        },
        "analyze": {
          "$ref": "#/definitions/phase"
        },
        "design": {
          "$ref": "#/definitions/phase"
        },
        "build": {
          "allOf": [
            {
              "$ref": "#/definitions/phase"
            }
          ],
          "properties": {
            "index_ref": {
              "type": "string",
              "description": "Puntero relativo a docs/specs/*-index.md. Es opcional antes del cierre de Analyze; si aparece antes se valida inmediatamente. Es obligatorio desde Analyze complete o cualquier fase posterior."
            }
          }
        },
        "verify": {
          "$ref": "#/definitions/phase"
        },
        "document": {
          "$ref": "#/definitions/phase"
        }
      }
    },
    "context_summary": {
      "type": "string",
      "description": "Resumen de 2-3 lineas del contexto clave para reconstruir la sesion sin releer todos los artefactos."
    },
    "resume_hint": {
      "type": "string",
      "description": "Proxima accion concreta para retomar sin ambiguedad."
    },
    "reconciliation": {
      "type": "object",
      "description": "Proveniencia de la última reconciliación válida con INDEX. Solo se escribe cuando existe un INDEX válido; los skips de fases tempranas no fabrican esta metadata.",
      "properties": {
        "schema_version": { "type": "integer", "enum": [1, 2] },
        "branch": { "type": ["string", "null"] },
        "head_commit": { "type": ["string", "null"] },
        "index_ref": { "type": "string" },
        "reconciled_at": { "type": "string", "format": "date-time" }
      },
      "required": ["schema_version", "branch", "head_commit", "index_ref", "reconciled_at"]
    },
    "artifact_seq": {
      "type": "integer",
      "minimum": 0,
      "default": 0,
      "description": "Contador monotónico por-run del SEQ de artefactos estampados; lo incrementa el helper de naming (.claude/scripts/asdd-artifact-name.mjs), nunca a mano."
    },
    "manifest_path": {
      "type": "string",
      "description": "Ruta universal del manifest del run, reservada al bootstrap con SEQ 000."
    },
    "artifact_naming": {
      "type": "object",
      "description": "Contrato de naming inyectado desde el inicio para todo artefacto nuevo bajo docs/**.",
      "properties": {
        "policy_version": { "type": "integer", "minimum": 2 },
        "pattern": { "type": "string", "const": "{run_id}-{PHASE}-{SEQ}-{slug}.{ext}" },
        "scope": { "type": "string", "const": "all-agent-generated-files-under-docs" },
        "code_excluded": { "type": "boolean", "const": true },
        "helper": { "type": "string" }
      },
      "required": ["policy_version", "pattern", "scope", "code_excluded", "helper"]
    },
    "blocking_issue": {
      "type": [
        "string",
        "null"
      ],
      "description": "Descripcion del bloqueo si status = blocked."
    },
    "escalations": {
      "type": "array",
      "description": "Registro de escalamientos LIGHT → FULL ocurridos en este run (ORC-001-C).",
      "items": {
        "type": "object",
        "properties": {
          "agent": {
            "type": "string",
            "description": "Agente que detectó la necesidad de escalar"
          },
          "motivo": {
            "type": "string",
            "enum": ["scope_mayor", "requiere_adr", "falta_artefacto", "codigo_critico", "rompe_contrato"]
          },
          "detalle": {
            "type": "string",
            "description": "Descripción breve de qué encontró el agente"
          },
          "fase_recomendada": {
            "type": "string",
            "enum": ["specify", "analyze", "design", "build", "verify", "document"]
          },
          "timestamp": {
            "type": "string",
            "format": "date-time"
          }
        }
      }
    },
    "auto_detected": {
      "type": ["object", "null"],
      "description": "Resultado de la auto-detección de codebase_size ejecutada por ORC-001-D al primer request LIGHT de la sesión. Null si la detección aún no se ejecutó o si project_context.maturity está fijado manualmente en el lock.",
      "properties": {
        "codebase_size": {
          "type": "string",
          "enum": ["small", "large"],
          "description": "Tamaño detectado del codebase. 'large' activa scope injection en ruta LIGHT."
        },
        "detected_at": {
          "type": "string",
          "format": "date-time",
          "description": "Timestamp de la detección. La detección no se reejecuta dentro del mismo run_id."
        },
        "signals": {
          "type": "object",
          "description": "Valores observados por cada señal de detección.",
          "properties": {
            "source_files": {
              "type": "integer",
              "minimum": 0,
              "description": "Cantidad de archivos fuente detectados según source_globs del lock."
            },
            "commits": {
              "type": "integer",
              "minimum": 0,
              "description": "Cantidad de commits en HEAD (git rev-list --count HEAD)."
            },
            "docs_files": {
              "type": "integer",
              "minimum": 0,
              "description": "Cantidad de archivos en docs/ según docs_glob del lock."
            }
          },
          "required": ["source_files", "commits", "docs_files"]
        },
        "signals_over_threshold": {
          "type": "integer",
          "minimum": 0,
          "maximum": 3,
          "description": "Cantidad de señales que superaron su umbral. Si >= signals_required del lock → large."
        },
        "overridden_by_lock": {
          "type": "boolean",
          "description": "true si project_context.maturity estaba fijado en el lock y la detección no se ejecutó."
        },
        "lock_value": {
          "type": ["string", "null"],
          "enum": ["small", "large", null],
          "description": "Valor del lock cuando overridden_by_lock = true."
        }
      },
      "required": ["codebase_size", "detected_at", "overridden_by_lock"]
    }
  },
  "definitions": {
    "phase": {
      "type": "object",
      "properties": {
        "status": {
          "type": "string",
          "enum": [
            "pending",
            "in_progress",
            "complete",
            "skipped"
          ]
        },
        "started_at": {
          "type": "string",
          "format": "date-time"
        },
        "completed_at": {
          "type": "string",
          "format": "date-time"
        },
        "agents_used": {
          "type": "array",
          "items": {
            "type": "string"
          }
        },
        "models_used": {
          "type": "object",
          "description": "Modelo resuelto por ORC-002-B para cada agente invocado en esta fase. Clave: nombre del agente. Valor: modelo usado (haiku|sonnet|opus).",
          "additionalProperties": {
            "type": "string",
            "enum": ["haiku", "sonnet", "opus"]
          }
        },
        "completed_steps": {
          "type": "array",
          "items": {
            "type": "string"
          },
          "description": "Pasos/sub-skills ya completados dentro de esta fase"
        },
        "pending_steps": {
          "type": "array",
          "items": {
            "type": "string"
          },
          "description": "Pasos/sub-skills pendientes dentro de esta fase"
        },
        "artifacts": {
          "type": "array",
          "items": {
            "type": "string"
          },
          "description": "Rutas relativas de artefactos producidos — los unicos archivos a leer al retomar"
        },
        "step_current": {
          "type": "integer",
          "minimum": 0,
          "description": "Índice del paso en curso dentro de la fase (base 0). Al reanudar, continuar desde step_current sin re-escanear pasos anteriores."
        },
        "step_total": {
          "type": "integer",
          "minimum": 1,
          "description": "Total de pasos planificados para esta fase. Permite calcular el porcentaje de avance: (step_current / step_total * 100)."
        },
        "progress_note": {
          "type": "string",
          "maxLength": 200,
          "description": "Nota legible del progreso para visibilidad del usuario. Ej: 'spec 3/5 generada', 'ADR 2/3 completo'. El orquestador la actualiza en cada checkpoint."
        }
      }
    }
  },
  "examples": [
    {
      "run_id": "2026-04-28-001",
      "feature": "Integracion pasarela de pagos",
      "started_at": "2026-04-28T10:00:00Z",
      "last_checkpoint": "2026-04-28T14:30:00Z",
      "status": "in_progress",
      "phases": {
        "specify": {
          "status": "complete",
          "completed_at": "2026-04-28T10:30:00Z",
          "agents_used": [
            "asdd-producto",
            "asdd-domain-expert"
          ],
          "models_used": {
            "asdd-producto": "sonnet",
            "asdd-domain-expert": "opus"
          },
          "artifacts": [
            "docs/specs/brief-pagos.md"
          ],
          "completed_steps": [],
          "pending_steps": []
        },
        "analyze": {
          "status": "complete",
          "completed_at": "2026-04-28T11:30:00Z",
          "agents_used": [
            "asdd-producto"
          ],
          "models_used": {
            "asdd-producto": "sonnet"
          },
          "artifacts": [
            "docs/specs/requirements-pagos.md"
          ],
          "completed_steps": [],
          "pending_steps": []
        },
        "design": {
          "status": "in_progress",
          "started_at": "2026-04-28T12:00:00Z",
          "agents_used": [
            "asdd-solution-architect"
          ],
          "models_used": {
            "asdd-solution-architect": "opus"
          },
          "artifacts": [
            "docs/architecture/decisions/ADR-001-payment-gateway.md"
          ],
          "completed_steps": [
            "architect-discovery",
            "architect-adr-001"
          ],
          "pending_steps": [
            "architect-component-diagram",
            "architect-api-contract"
          ],
          "step_current": 1,
          "step_total": 4,
          "progress_note": "ADR-001 completo — pendientes: component-diagram, api-contract, bounded-context"
        },
        "build": {
          "status": "pending"
        },
        "verify": {
          "status": "pending"
        },
        "document": {
          "status": "pending"
        }
      },
      "context_summary": "Feature: integracion pasarela de pagos. Bounded context: payment-gateway separado del core-banking. ADR-001 aprobado: patron Saga para compensacion de transacciones.",
      "resume_hint": "Invocar asdd-solution-architect con skill architect-component-diagram para modelar el bounded context payment-gateway.",
      "blocking_issue": null,
      "escalations": [],
      "auto_detected": {
        "codebase_size": "large",
        "detected_at": "2026-04-28T10:00:00Z",
        "signals": {
          "source_files": 347,
          "commits": 412,
          "docs_files": 45
        },
        "signals_over_threshold": 3,
        "overridden_by_lock": false,
        "lock_value": null
      }
    }
  ]
}
